[
  {"id":"RULE-001","type":"regel","title":"Nicht ausgeführte Pflichtprüfung ist kein PASS","summary":"Ein nicht ausführbarer oder unbekannter Pflichtcheck darf eine Freigabe nicht positiv bestätigen.","primary_category":"Tests","categories":["Release","Evidence","Fehlervermeidung"],"tags":["Gate","UNAVAILABLE","PASS"],"projects":["PROVOWARE Knowledge & Project Intelligence"],"priority":"P0","maturity":"E3","scope":"global","automatable":true,"status":"bestaetigt","revision":1,"sources":[{"kind":"projektchat","ref":"Wissensspeicher Autopilot Auftrag 2026-08-09","claim":"Unbekannt bzw. nicht ausführbar darf niemals als PASS gewertet werden."}]},
  {"id":"RULE-002","type":"regel","title":"Ein Wissenseintrag wird einmal gespeichert und vielfach sichtbar","summary":"Mehrfachzuordnung wird über Beziehungen und Facetten gelöst, nicht durch Datenkopien.","primary_category":"Informationsarchitektur","categories":["Dubletten","Navigation","Datenmodell"],"tags":["Single Source of Truth","Facetten"],"projects":["PROVOWARE Knowledge & Project Intelligence"],"priority":"P0","maturity":"E3","scope":"projekt","automatable":true,"status":"bestaetigt","revision":1,"sources":[{"kind":"projektdatei","ref":"WISSENSSPEICHERBUCH_UND_TOOL.txt","claim":"Ein Eintrag darf mehrfach sichtbar sein, aber nur einmal gespeichert werden."}]},
  {"id":"STD-001","type":"standard","title":"Erkenntnisreife E0 bis E5 und Priorität P0 bis P3 getrennt führen","summary":"Reife einer Erkenntnis und Dringlichkeit einer Maßnahme sind unabhängige Achsen.","primary_category":"Governance","categories":["Priorisierung","Wissensreife"],"tags":["E0-E5","P0-P3"],"projects":["PROVOWARE Knowledge & Project Intelligence"],"priority":"P0","maturity":"E4","scope":"projekt","automatable":true,"status":"standard","revision":1,"sources":[{"kind":"projektdatei","ref":"WISSENSSPEICHERBUCH_UND_TOOL.txt","claim":"Reifestufen und Prioritäten sind getrennte Dimensionen."}]},
  {"id":"RULE-003","type":"regel","title":"Dubletten bevorzugt konsolidieren, Widersprüche nicht verdecken","summary":"Ähnliche Erkenntnisse verbessern bestehende Einträge; echte Konflikte bleiben sichtbar.","primary_category":"Wissenskonsolidierung","categories":["Dubletten","Konflikte","Historie"],"tags":["Merge","Conflict"],"projects":["PROVOWARE Knowledge & Project Intelligence"],"priority":"P0","maturity":"E3","scope":"projekt","automatable":true,"status":"bestaetigt","revision":1,"sources":[{"kind":"projektdatei","ref":"WISSENSSPEICHERBUCH_UND_TOOL.txt","claim":"Dubletten sollen zusammengeführt und Widersprüche markiert werden."}]},
  {"id":"AUTO-001","type":"automatisierung","title":"Wissenseingang vor Aufnahme automatisch vorprüfen","summary":"Neue Kandidaten erhalten vor Übernahme eine deterministische Basisprüfung.","primary_category":"Automation","categories":["Wissenseingang","Validierung"],"tags":["Inbox","Preflight"],"projects":["PROVOWARE Knowledge & Project Intelligence"],"priority":"P1","maturity":"E2","scope":"projekt","automatable":true,"status":"bestaetigt","revision":1,"sources":[{"kind":"projektdatei","ref":"WISSENSSPEICHERBUCH_UND_TOOL.txt","claim":"Knowledge Inbox und automatische Dublettenerkennung sind vorgesehen."}]},
  {"id":"RULE-004","type":"regel","title":"Wissensänderungen müssen nachvollziehbar protokolliert werden","summary":"Neue, verbesserte, zusammengeführte oder umbewertete Erkenntnisse erhalten ein separates Delta-Ereignis mit Grund und Herkunft.","primary_category":"Historie","categories":["Audit","Wissenskonsolidierung","Nachvollziehbarkeit"],"tags":["Delta","Historie","Evidence"],"projects":["PROVOWARE Knowledge & Project Intelligence"],"priority":"P1","maturity":"E3","scope":"projekt","automatable":true,"status":"bestaetigt","revision":1,"sources":[{"kind":"projektdatei","ref":"WISSENSSPEICHERBUCH_UND_TOOL.txt","claim":"Wesentliche Regeländerungen und Wissensänderungen sollen nachvollziehbar versioniert und historisch sichtbar bleiben."},{"kind":"projektdatei","ref":"CHANGELOG.md","claim":"Die bisherigen Iterationen dokumentieren Änderungen bereits getrennt nach hinzugefügt, geändert und Qualitätsentscheidungen."}]},
  {"id":"RULE-005","type":"regel","title":"Vor dem ersten Wissensschreibvorgang muss ein reproduzierbarer Änderungsplan vorliegen","summary":"Eine Inbox-Übernahme wird zuerst als unverändernde Vorschau mit Zielzustand, Hash, Delta und Undo-Information erzeugt.","primary_category":"Daten & Integrität","categories":["Recovery","Evidence & Audit","Wissenskonsolidierung"],"tags":["Preview","Undo","Hash","Write Safety"],"projects":["PROVOWARE Knowledge & Project Intelligence"],"priority":"P0","maturity":"E2","scope":"projekt","automatable":true,"status":"bestaetigt","revision":1,"sources":[{"kind":"projektchat","ref":"Wissensspeicher Autopilot – Iteration 004","claim":"Vor einer echten Inbox-Übernahme sollen Änderungsplan, Delta, Undo und deterministische Hashgrundlage zunächst nur als Preview entstehen."},{"kind":"projektdatei","ref":"schemas/change-plan.schema.json","claim":"Iteration 005 definiert die schreibfreie Änderungsplan-Vorschau maschinenlesbar."}]},
  {"id":"RULE-006","type":"regel","title":"Ein Commit darf erst nach reproduzierbarer Preview-Evidence vorbereitet werden","summary":"Zwei unabhängige Vorschau-Läufe müssen denselben Zielzustand, Plan-Hash und Undo-Bezug liefern, bevor ein Commit-Intent zulässig wird.","primary_category":"Evidence & Audit","categories":["Daten & Integrität","Recovery","Tests"],"tags":["Reproducibility","Preview Evidence","Commit Gate"],"projects":["PROVOWARE Knowledge & Project Intelligence"],"priority":"P0","maturity":"E2","scope":"projekt","automatable":true,"status":"bestaetigt","revision":1,"sources":[{"kind":"projektchat","ref":"Wissensspeicher Autopilot – Iteration 005","claim":"Vor dem ersten Commit sollen zwei unabhängige Preview-Läufe identischen Zielzustand und identische SHA-256-Nachweise erzeugen."},{"kind":"projektdatei","ref":"schemas/preview-evidence.schema.json","claim":"Iteration 006 definiert den maschinenlesbaren Evidence-Vertrag für reproduzierbare Preview-Läufe."}]},
  {"id":"RULE-007","type":"regel","title":"Ein Schreib-Intent muss an den unveränderten Projektzustand gebunden sein","summary":"Eine spätere Wissensübernahme darf nur vorbereitet bleiben, solange Preview-Evidence, kanonischer Projektzustand, Zielhash und Undo-Plan unverändert sind.","primary_category":"Daten & Integrität","categories":["Evidence & Audit","Recovery","Wissenskonsolidierung"],"tags":["Commit Intent","Stale Guard","Project State Hash"],"projects":["PROVOWARE Knowledge & Project Intelligence"],"priority":"P0","maturity":"E2","scope":"projekt","automatable":true,"status":"bestaetigt","revision":1,"sources":[{"kind":"projektchat","ref":"Wissensspeicher Autopilot – Iteration 006","claim":"Der nächste Vertrag soll Preview-Evidence, Ausgangsbestand, Zielhash und Undo-Plan binden und bei Zustandsänderung STALE liefern."},{"kind":"projektdatei","ref":"schemas/commit-intent.schema.json","claim":"Iteration 007 definiert den maschinenlesbaren Intent-Vertrag ohne echten Wissensschreibvorgang."}]}
]
